{
  "schema_version": "1.0",
  "source_file": "inventory_orders_sample.xlsm",
  "modules": [
    {
      "name": "modInventory",
      "type": "standard",
      "summary": "Mock analysis (no model was used).",
      "line_count": 164,
      "procedure_count": 11
    },
    {
      "name": "modUtils",
      "type": "standard",
      "summary": "Mock analysis (no model was used).",
      "line_count": 16,
      "procedure_count": 3
    },
    {
      "name": "clsProduct",
      "type": "standard",
      "summary": "Mock analysis (no model was used).",
      "line_count": 31,
      "procedure_count": 6
    },
    {
      "name": "ThisWorkbook",
      "type": "sheet",
      "summary": "Mock analysis (no model was used).",
      "line_count": 28,
      "procedure_count": 2
    }
  ],
  "procedures": [
    {
      "id": "modInventory.AddProduct",
      "module": "modInventory",
      "name": "AddProduct",
      "kind": "Sub",
      "scope": "Public",
      "params": [
        {
          "name": "sku",
          "type": "String",
          "optional": false,
          "by_val": true
        },
        {
          "name": "productName",
          "type": "String",
          "optional": false,
          "by_val": true
        },
        {
          "name": "category",
          "type": "String",
          "optional": false,
          "by_val": true
        },
        {
          "name": "unitPrice",
          "type": "Double",
          "optional": false,
          "by_val": true
        },
        {
          "name": "stock",
          "type": "Long",
          "optional": false,
          "by_val": true
        },
        {
          "name": "reorderLevel",
          "type": "Long",
          "optional": false,
          "by_val": true
        }
      ],
      "returns": null,
      "start_line": 8,
      "end_line": 23,
      "role": "utility",
      "summary": "Mock summary.",
      "calls": [],
      "reads": [],
      "writes": [],
      "support": "supported",
      "support_reason": "Mock provider: nothing was analyzed.",
      "analyzed": true
    },
    {
      "id": "modInventory.FindProductRow",
      "module": "modInventory",
      "name": "FindProductRow",
      "kind": "Function",
      "scope": "Public",
      "params": [
        {
          "name": "sku",
          "type": "String",
          "optional": false,
          "by_val": true
        }
      ],
      "returns": "Long",
      "start_line": 26,
      "end_line": 34,
      "role": "utility",
      "summary": "Mock summary.",
      "calls": [],
      "reads": [],
      "writes": [],
      "support": "supported",
      "support_reason": "Mock provider: nothing was analyzed.",
      "analyzed": true
    },
    {
      "id": "modInventory.LookupPrice",
      "module": "modInventory",
      "name": "LookupPrice",
      "kind": "Function",
      "scope": "Public",
      "params": [
        {
          "name": "sku",
          "type": "String",
          "optional": false,
          "by_val": true
        }
      ],
      "returns": "Double",
      "start_line": 36,
      "end_line": 44,
      "role": "utility",
      "summary": "Mock summary.",
      "calls": [],
      "reads": [],
      "writes": [],
      "support": "supported",
      "support_reason": "Mock provider: nothing was analyzed.",
      "analyzed": true
    },
    {
      "id": "modInventory.GetDiscount",
      "module": "modInventory",
      "name": "GetDiscount",
      "kind": "Function",
      "scope": "Public",
      "params": [
        {
          "name": "qty",
          "type": "Long",
          "optional": false,
          "by_val": true
        }
      ],
      "returns": "Double",
      "start_line": 47,
      "end_line": 58,
      "role": "utility",
      "summary": "Mock summary.",
      "calls": [],
      "reads": [],
      "writes": [],
      "support": "supported",
      "support_reason": "Mock provider: nothing was analyzed.",
      "analyzed": true
    },
    {
      "id": "modInventory.CalcOrderTotal",
      "module": "modInventory",
      "name": "CalcOrderTotal",
      "kind": "Function",
      "scope": "Public",
      "params": [
        {
          "name": "unitPrice",
          "type": "Double",
          "optional": false,
          "by_val": true
        },
        {
          "name": "qty",
          "type": "Long",
          "optional": false,
          "by_val": true
        }
      ],
      "returns": "Double",
      "start_line": 60,
      "end_line": 64,
      "role": "utility",
      "summary": "Mock summary.",
      "calls": [],
      "reads": [],
      "writes": [],
      "support": "supported",
      "support_reason": "Mock provider: nothing was analyzed.",
      "analyzed": true
    },
    {
      "id": "modInventory.PlaceOrder",
      "module": "modInventory",
      "name": "PlaceOrder",
      "kind": "Function",
      "scope": "Public",
      "params": [
        {
          "name": "sku",
          "type": "String",
          "optional": false,
          "by_val": true
        },
        {
          "name": "qty",
          "type": "Long",
          "optional": false,
          "by_val": true
        }
      ],
      "returns": "Boolean",
      "start_line": 67,
      "end_line": 100,
      "role": "utility",
      "summary": "Mock summary.",
      "calls": [],
      "reads": [],
      "writes": [],
      "support": "supported",
      "support_reason": "Mock provider: nothing was analyzed.",
      "analyzed": true
    },
    {
      "id": "modInventory.CheckReorder",
      "module": "modInventory",
      "name": "CheckReorder",
      "kind": "Sub",
      "scope": "Public",
      "params": [
        {
          "name": "sku",
          "type": "String",
          "optional": false,
          "by_val": true
        }
      ],
      "returns": null,
      "start_line": 102,
      "end_line": 111,
      "role": "utility",
      "summary": "Mock summary.",
      "calls": [],
      "reads": [],
      "writes": [],
      "support": "supported",
      "support_reason": "Mock provider: nothing was analyzed.",
      "analyzed": true
    },
    {
      "id": "modInventory.RefreshStockStatus",
      "module": "modInventory",
      "name": "RefreshStockStatus",
      "kind": "Sub",
      "scope": "Public",
      "params": [],
      "returns": null,
      "start_line": 114,
      "end_line": 127,
      "role": "utility",
      "summary": "Mock summary.",
      "calls": [],
      "reads": [],
      "writes": [],
      "support": "supported",
      "support_reason": "Mock provider: nothing was analyzed.",
      "analyzed": true
    },
    {
      "id": "modInventory.ExportLowStockCSV",
      "module": "modInventory",
      "name": "ExportLowStockCSV",
      "kind": "Sub",
      "scope": "Public",
      "params": [],
      "returns": null,
      "start_line": 130,
      "end_line": 149,
      "role": "utility",
      "summary": "Mock summary.",
      "calls": [],
      "reads": [],
      "writes": [],
      "support": "partial",
      "support_reason": "File write (found by the rule check).",
      "analyzed": true
    },
    {
      "id": "modInventory.ExportOrdersPDF",
      "module": "modInventory",
      "name": "ExportOrdersPDF",
      "kind": "Sub",
      "scope": "Public",
      "params": [],
      "returns": null,
      "start_line": 151,
      "end_line": 153,
      "role": "utility",
      "summary": "Mock summary.",
      "calls": [],
      "reads": [],
      "writes": [],
      "support": "unsupported",
      "support_reason": "Excel PDF export through COM (found by the rule check).",
      "analyzed": true
    },
    {
      "id": "modInventory.EmailLowStockReport",
      "module": "modInventory",
      "name": "EmailLowStockReport",
      "kind": "Sub",
      "scope": "Public",
      "params": [],
      "returns": null,
      "start_line": 155,
      "end_line": 164,
      "role": "utility",
      "summary": "Mock summary.",
      "calls": [],
      "reads": [],
      "writes": [],
      "support": "unsupported",
      "support_reason": "COM automation of another application (found by the rule check).",
      "analyzed": true
    },
    {
      "id": "modUtils.FormatSku",
      "module": "modUtils",
      "name": "FormatSku",
      "kind": "Function",
      "scope": "Public",
      "params": [
        {
          "name": "text",
          "type": "String",
          "optional": false,
          "by_val": true
        }
      ],
      "returns": "String",
      "start_line": 6,
      "end_line": 8,
      "role": "utility",
      "summary": "Mock summary.",
      "calls": [],
      "reads": [],
      "writes": [],
      "support": "supported",
      "support_reason": "Mock provider: nothing was analyzed.",
      "analyzed": true
    },
    {
      "id": "modUtils.IsValidQty",
      "module": "modUtils",
      "name": "IsValidQty",
      "kind": "Function",
      "scope": "Public",
      "params": [
        {
          "name": "qty",
          "type": "Long",
          "optional": false,
          "by_val": true
        }
      ],
      "returns": "Boolean",
      "start_line": 10,
      "end_line": 12,
      "role": "utility",
      "summary": "Mock summary.",
      "calls": [],
      "reads": [],
      "writes": [],
      "support": "supported",
      "support_reason": "Mock provider: nothing was analyzed.",
      "analyzed": true
    },
    {
      "id": "modUtils.PauseBriefly",
      "module": "modUtils",
      "name": "PauseBriefly",
      "kind": "Sub",
      "scope": "Public",
      "params": [],
      "returns": null,
      "start_line": 14,
      "end_line": 16,
      "role": "utility",
      "summary": "Mock summary.",
      "calls": [],
      "reads": [],
      "writes": [],
      "support": "supported",
      "support_reason": "Mock provider: nothing was analyzed.",
      "analyzed": true
    },
    {
      "id": "clsProduct.Sku",
      "module": "clsProduct",
      "name": "Sku",
      "kind": "Property Get",
      "scope": "Public",